metric_category,metric_data_type,metric_field_description,metric_filterable,metric_name,metric_repeated,metric_selectable,metric_sortable,metric_type_url
METRIC,INT64,Number of impressions in which the store location was shown or the location was used for targeting. This measure is coming from Asset based location.,True,metrics.eligible_impressions_from_location_asset_store_reach,False,True,True,N/A
METRIC,DOUBLE,How often people engage with your ad after it's shown to them. This is the number of ad expansions divided by the number of times your ad is shown.,True,metrics.engagement_rate,False,True,True,N/A
METRIC,INT64,"The number of engagements. An engagement occurs when a viewer expands your Lightbox ad. Also, in the future, other ad types may support engagement metrics.",True,metrics.engagements,False,True,True,N/A
METRIC,INT64,The number of times the ad was forwarded to someone else as a message.,True,metrics.gmail_forwards,False,True,True,N/A
METRIC,INT64,The number of times someone has saved your Gmail ad to their inbox as a message.,True,metrics.gmail_saves,False,True,True,N/A
METRIC,INT64,The number of clicks to the landing page on the expanded state of Gmail ads.,True,metrics.gmail_secondary_clicks,False,True,True,N/A
METRIC,DOUBLE,"Gross profit margin is the percentage gross profit you made from orders attributed to your ads, after taking out the cost of goods sold (COGS). How it works: You report conversions with cart data for completed purchases on your website. Gross profit margin is the gross profit you made divided by your total revenue and multiplied by 100%. Gross profit margin calculations only include products that have a cost of goods sold value in Merchant Center. Example: Someone bought a hat and a shirt in an order on your website. The hat is priced $10 and has a cost of goods sold value of $3. The shirt is priced $20 but has no cost of goods sold value. Gross profit margin for this order will only take into account the hat because it has a cost of goods sold value, so it's 70% = ($10 - $3)/$10 x 100%. This metric is only available if you report conversions with cart data.",True,metrics.gross_profit_margin,False,True,True,N/A
METRIC,INT64,"Gross profit is the profit you made from orders attributed to your ads minus the cost of goods sold (COGS). How it works: Gross profit is the revenue you made from sales attributed to your ads minus cost of goods sold. Gross profit calculations only include products that have a cost of goods sold value in Merchant Center. Example: Someone clicked on a Shopping ad for a hat then bought the same hat and a shirt in an order from your website. The hat is priced $10 and the shirt is priced $20. The hat has a cost of goods sold value of $3, but the shirt has no cost of goods sold value. Gross profit for this order will only take into account the hat, so it's $7 = $10 - $3. This metric is only available if you report conversions with cart data.",True,metrics.gross_profit_micros,False,True,True,N/A
METRIC,ENUM,The creative historical quality score.,True,metrics.historical_creative_quality_score,False,True,True,google.ads.googleads.v15.enums.QualityScoreBucketEnum.QualityScoreBucket
METRIC,ENUM,The quality of historical landing page experience.,True,metrics.historical_landing_page_quality_score,False,True,True,google.ads.googleads.v15.enums.QualityScoreBucketEnum.QualityScoreBucket
METRIC,INT64,The historical quality score.,True,metrics.historical_quality_score,False,True,True,N/A
METRIC,ENUM,The historical search predicted click through rate (CTR).,True,metrics.historical_search_predicted_ctr,False,True,True,google.ads.googleads.v15.enums.QualityScoreBucketEnum.QualityScoreBucket
METRIC,DOUBLE,Average lead value based on clicks.,True,metrics.hotel_average_lead_value_micros,False,True,True,N/A
METRIC,INT64,"Commission bid rate in micros. A 20% commission is represented as 200,000.",True,metrics.hotel_commission_rate_micros,False,True,True,N/A
METRIC,INT64,The number of impressions that hotel partners could have had given their feed performance.,True,metrics.hotel_eligible_impressions,False,True,True,N/A
METRIC,DOUBLE,Expected commission cost. The result of multiplying the commission value times the hotel_commission_rate in advertiser currency.,True,metrics.hotel_expected_commission_cost,False,True,True,N/A
METRIC,DOUBLE,The average price difference between the price offered by reporting hotel advertiser and the cheapest price offered by the competing advertiser.,True,metrics.hotel_price_difference_percentage,False,True,True,N/A
METRIC,INT64,Count of how often your ad has appeared on a search results page or website on the Google Network.,True,metrics.impressions,False,True,True,N/A
METRIC,INT64,The number of times a store's location-based ad was shown. This metric applies to feed items only.,True,metrics.impressions_from_store_reach,False,True,True,N/A
METRIC,ENUM,The types of payable and free interactions.,True,metrics.interaction_event_types,True,True,False,google.ads.googleads.v15.enums.InteractionEventTypeEnum.InteractionEventType
METRIC,DOUBLE,How often people interact with your ad after it is shown to them. This is the number of interactions divided by the number of times your ad is shown.,True,metrics.interaction_rate,False,True,True,N/A
METRIC,INT64,"The number of interactions. An interaction is the main user action associated with an ad format-clicks for text and shopping ads, views for video ads, and so on.",True,metrics.interactions,False,True,True,N/A
METRIC,DOUBLE,The percentage of clicks filtered out of your total number of clicks (filtered + non-filtered clicks) during the reporting period.,True,metrics.invalid_click_rate,False,True,True,N/A
METRIC,INT64,Number of clicks Google considers illegitimate and doesn't charge you for.,True,metrics.invalid_clicks,False,True,True,N/A
METRIC,INT64,"Lead cost of goods sold (COGS) is the total cost of products sold as a result of advertising the same product. How it works: You report conversions with cart data for completed purchases on your website. If the ad that was interacted with has an associated product (see Shopping Ads) then this product is considered the advertised product. Any product included in the order the customer places is a sold product. If the advertised and sold products match, then the cost of these goods is counted under lead cost of goods sold. Example: Someone clicked on a Shopping ad for a hat then bought the same hat and a shirt. The hat has a cost of goods sold value of $3, the shirt has a cost of goods sold value of $5. The lead cost of goods sold for this order is $3. This metric is only available if you report conversions with cart data.",True,metrics.lead_cost_of_goods_sold_micros,False,True,True,N/A
METRIC,INT64,"Lead gross profit is the profit you made from products sold as a result of advertising the same product, minus cost of goods sold (COGS). How it works: You report conversions with cart data for completed purchases on your website. If the ad that was interacted with before the purchase has an associated product (see Shopping Ads) then this product is considered the advertised product. Any product included in the order the customer places is a sold product. If the advertised and sold products match, then the revenue you made from these sales minus the cost of goods sold is your lead gross profit. Example: Someone clicked on a Shopping ad for a hat then bought the same hat and a shirt. The hat is priced $10 and has a cost of goods sold value of $3. The lead gross profit of this order is $7 = $10 - $3. This metric is only available if you report conversions with cart data.",True,metrics.lead_gross_profit_micros,False,True,True,N/A
METRIC,INT64,"Lead revenue is the total amount you made from products sold as a result of advertising the same product. How it works: You report conversions with cart data for completed purchases on your website. If the ad that was interacted with before the purchase has an associated product (see Shopping Ads) then this product is considered the advertised product. Any product included in the order the customer places is a sold product. If the advertised and sold products match, then the total value you made from the sales of these products is shown under lead revenue. Example: Someone clicked on a Shopping ad for a hat then bought the same hat and a shirt. The hat is priced $10 and the shirt is priced $20. The lead revenue of this order is $10. This metric is only available if you report conversions with cart data.",True,metrics.lead_revenue_micros,False,True,True,N/A
METRIC,DOUBLE,"Lead units sold is the total number of products sold as a result of advertising the same product. How it works: You report conversions with cart data for completed purchases on your website. If the ad that was interacted with before the purchase has an associated product (see Shopping Ads) then this product is considered the advertised product. Any product included in the order the customer places is a sold product. If the advertised and sold products match, then the total number of these products sold is shown under lead units sold. Example: Someone clicked on a Shopping ad for a hat then bought the same hat, a shirt and a jacket. The lead units sold in this order is 1. This metric is only available if you report conversions with cart data.",True,metrics.lead_units_sold,False,True,True,N/A
METRIC,DOUBLE,Number of message chats initiated (message_chats) divided by the number of message impressions (message_impressions). Rate at which a user initiates a message chat from an ad impression with a messaging option and message tracking enabled. Note that this rate can be more than 1.0 for a given message impression.,True,metrics.message_chat_rate,False,True,True,N/A
METRIC,INT64,Number of message chats initiated for Click To Message impressions that were message tracking eligible.,True,metrics.message_chats,False,True,True,N/A
METRIC,INT64,Number of Click To Message impressions that were message tracking eligible.,True,metrics.message_impressions,False,True,True,N/A
METRIC,DOUBLE,The percentage of mobile clicks that go to a mobile-friendly page.,True,metrics.mobile_friendly_clicks_percentage,False,True,True,N/A
METRIC,DOUBLE,"New customers' lifetime conversion value. If you have set up customer acquisition goal at either account level or campaign level, this will include the additional conversion value from new customers for biddable conversions. If your campaign has adopted the customer acquisition goal and selected ""bid higher for new customers"", these values will be included in ""conversions_value"" for optimization. See ",True,metrics.new_customer_lifetime_value,False,True,True,N/A
METRIC,DOUBLE,Total optimization score uplift of all recommendations.,True,metrics.optimization_score_uplift,False,True,True,N/A
METRIC,STRING,URL for the optimization score page in the Google Ads web interface. This metric can be selected from ,True,metrics.optimization_score_url,False,True,True,N/A
METRIC,DOUBLE,"Orders is the total number of purchase conversions you received attributed to your ads. How it works: You report conversions with cart data for completed purchases on your website. If a conversion is attributed to previous interactions with your ads (clicks for text or Shopping ads, views for video ads etc.) it's counted as an order. Example: Someone clicked on a Shopping ad for a hat then bought the same hat and a shirt in an order on your website. Even though they bought 2 products, this would count as 1 order. This metric is only available if you report conversions with cart data.",True,metrics.orders,False,True,True,N/A
METRIC,INT64,The number of times someone clicked your site's listing in the unpaid results for a particular query. See the help page at ,True,metrics.organic_clicks,False,True,True,N/A
METRIC,DOUBLE,The number of times someone clicked your site's listing in the unpaid results (organic_clicks) divided by the total number of searches that returned pages from your site (organic_queries). See the help page at ,True,metrics.organic_clicks_per_query,False,True,True,N/A
METRIC,INT64,The number of listings for your site in the unpaid search results. See the help page at ,True,metrics.organic_impressions,False,True,True,N/A
METRIC,DOUBLE,The number of times a page from your site was listed in the unpaid search results (organic_impressions) divided by the number of searches returning your site's listing in the unpaid results (organic_queries). See the help page at ,True,metrics.organic_impressions_per_query,False,True,True,N/A
METRIC,INT64,The total number of searches that returned your site's listing in the unpaid results. See the help page at ,True,metrics.organic_queries,False,True,True,N/A
METRIC,DOUBLE,Percentage of first-time sessions (from people who had never visited your site before). Imported from Google Analytics.,True,metrics.percent_new_visitors,False,True,True,N/A
METRIC,INT64,Number of offline phone calls.,True,metrics.phone_calls,False,True,True,N/A
METRIC,INT64,Number of offline phone impressions.,True,metrics.phone_impressions,False,True,True,N/A
METRIC,DOUBLE,Number of phone calls received (phone_calls) divided by the number of times your phone number is shown (phone_impressions).,True,metrics.phone_through_rate,False,True,True,N/A
METRIC,INT64,Clicks from properties for which the traffic the publisher has not paid for or acquired through incentivized activity,True,metrics.publisher_organic_clicks,False,True,True,N/A
METRIC,INT64,Clicks from properties not owned by the publisher for which the traffic the publisher has paid for or acquired through incentivized activity,True,metrics.publisher_purchased_clicks,False,True,True,N/A
METRIC,INT64,"Clicks from traffic which is not identified as ""Publisher Purchased"" or ""Publisher Organic""",True,metrics.publisher_unknown_clicks,False,True,True,N/A
METRIC,DOUBLE,Your clickthrough rate (Ctr) divided by the average clickthrough rate of all advertisers on the websites that show your ads. Measures how your ads perform on Display Network sites compared to other ads on the same sites.,True,metrics.relative_ctr,False,True,True,N/A
METRIC,INT64,"Revenue is the total amount you made from orders attributed to your ads. How it works: You report conversions with cart data for completed purchases on your website. Revenue is the total value of all the orders you received attributed to your ads, minus any discount. Example: Someone clicked on a Shopping ad for a hat then bought the same hat and a shirt in an order from your website. The hat is priced $10 and the shirt is priced $20. The entire order has a $5 discount. The revenue from this order is $25 = ($10 + $20) - $5. This metric is only available if you report conversions with cart data.",True,metrics.revenue_micros,False,True,True,N/A
METRIC,DOUBLE,The percentage of the customer's Shopping or Search ad impressions that are shown in the most prominent Shopping position. See ,True,metrics.search_absolute_top_impression_share,False,True,True,N/A
METRIC,DOUBLE,The number estimating how often your ad wasn't the very first ad above the organic search results due to a low budget. Note: Search budget lost absolute top impression share is reported in the range of 0 to 0.9. Any value above 0.9 is reported as 0.9001.,True,metrics.search_budget_lost_absolute_top_impression_share,False,True,True,N/A
METRIC,DOUBLE,The estimated percent of times that your ad was eligible to show on the Search Network but didn't because your budget was too low. Note: Search budget lost impression share is reported in the range of 0 to 0.9. Any value above 0.9 is reported as 0.9001.,True,metrics.search_budget_lost_impression_share,False,True,True,N/A
METRIC,DOUBLE,The number estimating how often your ad didn't show anywhere above the organic search results due to a low budget. Note: Search budget lost top impression share is reported in the range of 0 to 0.9. Any value above 0.9 is reported as 0.9001.,True,metrics.search_budget_lost_top_impression_share,False,True,True,N/A
METRIC,DOUBLE,The number of clicks you've received on the Search Network divided by the estimated number of clicks you were eligible to receive. Note: Search click share is reported in the range of 0.1 to 1. Any value below 0.1 is reported as 0.0999.,True,metrics.search_click_share,False,True,True,N/A
METRIC,DOUBLE,"The impressions you've received divided by the estimated number of impressions you were eligible to receive on the Search Network for search terms that matched your keywords exactly (or were close variants of your keyword), regardless of your keyword match types. Note: Search exact match impression share is reported in the range of 0.1 to 1. Any value below 0.1 is reported as 0.0999.",True,metrics.search_exact_match_impression_share,False,True,True,N/A
METRIC,DOUBLE,The impressions you've received on the Search Network divided by the estimated number of impressions you were eligible to receive. Note: Search impression share is reported in the range of 0.1 to 1. Any value below 0.1 is reported as 0.0999.,True,metrics.search_impression_share,False,True,True,N/A
METRIC,DOUBLE,The number estimating how often your ad wasn't the very first ad above the organic search results due to poor Ad Rank. Note: Search rank lost absolute top impression share is reported in the range of 0 to 0.9. Any value above 0.9 is reported as 0.9001.,True,metrics.search_rank_lost_absolute_top_impression_share,False,True,True,N/A
METRIC,DOUBLE,The estimated percentage of impressions on the Search Network that your ads didn't receive due to poor Ad Rank. Note: Search rank lost impression share is reported in the range of 0 to 0.9. Any value above 0.9 is reported as 0.9001.,True,metrics.search_rank_lost_impression_share,False,True,True,N/A
METRIC,DOUBLE,The number estimating how often your ad didn't show anywhere above the organic search results due to poor Ad Rank. Note: Search rank lost top impression share is reported in the range of 0 to 0.9. Any value above 0.9 is reported as 0.9001.,True,metrics.search_rank_lost_top_impression_share,False,True,True,N/A
METRIC,DOUBLE,The impressions you've received in the top location (anywhere above the organic search results) compared to the estimated number of impressions you were eligible to receive in the top location. Note: Search top impression share is reported in the range of 0.1 to 1. Any value below 0.1 is reported as 0.0999.,True,metrics.search_top_impression_share,False,True,True,N/A
METRIC,MESSAGE,Search volume range for a search term insight category.,False,metrics.search_volume,False,True,True,google.ads.googleads.v15.common.SearchVolumeRange
METRIC,INT64,The number of iOS Store Kit Ad Network conversions.,True,metrics.sk_ad_network_installs,False,True,True,N/A
METRIC,INT64,The total number of iOS Store Kit Ad Network conversions.,True,metrics.sk_ad_network_total_conversions,False,True,True,N/A
METRIC,INT64,"A measure of how quickly your page loads after clicks on your mobile ads. The score is a range from 1 to 10, 10 being the fastest.",True,metrics.speed_score,False,True,True,N/A
METRIC,DOUBLE,The percent of your ad impressions that are shown anywhere above the organic search results.,True,metrics.top_impression_percentage,False,True,True,N/A
METRIC,INT64,"The number of unique users who saw your ad during the requested time period. This metric cannot be aggregated, and can only be requested for date ranges of 92 days or less. This metric is available for following campaign types - Display, Video, Discovery and App.",True,metrics.unique_users,False,True,True,N/A
METRIC,DOUBLE,"Units sold is the total number of products sold from orders attributed to your ads. How it works: You report conversions with cart data for completed purchases on your website. Units sold is the total number of products sold from all orders attributed to your ads. Example: Someone clicked on a Shopping ad for a hat then bought the same hat, a shirt and a jacket. The units sold in this order is 3. This metric is only available if you report conversions with cart data.",True,metrics.units_sold,False,True,True,N/A
METRIC,DOUBLE,The percentage of ad clicks to Accelerated Mobile Pages (AMP) landing pages that reach a valid AMP page.,True,metrics.valid_accelerated_mobile_pages_clicks_percentage,False,True,True,N/A
METRIC,DOUBLE,The value of all conversions divided by the number of all conversions.,True,metrics.value_per_all_conversions,False,True,True,N/A
METRIC,DOUBLE,"The value of all conversions divided by the number of all conversions. When this column is selected with date, the values in date column means the conversion date. Details for the by_conversion_date columns are available at ",True,metrics.value_per_all_conversions_by_conversion_date,False,True,True,N/A
METRIC,DOUBLE,"The value of conversions divided by the number of conversions. This only includes conversion actions which include_in_conversions_metric attribute is set to true. If you use conversion-based bidding, your bid strategies will optimize for these conversions.",True,metrics.value_per_conversion,False,True,True,N/A
METRIC,DOUBLE,"The value of conversions divided by the number of conversions. This only includes conversion actions which include_in_conversions_metric attribute is set to true. If you use conversion-based bidding, your bid strategies will optimize for these conversions. When this column is selected with date, the values in date column means the conversion date. Details for the by_conversion_date columns are available at ",True,metrics.value_per_conversions_by_conversion_date,False,True,True,N/A
METRIC,DOUBLE,"The value of current model attributed conversions divided by the number of the conversions. This only includes conversion actions which include_in_conversions_metric attribute is set to true. If you use conversion-based bidding, your bid strategies will optimize for these conversions.",True,metrics.value_per_current_model_attributed_conversion,False,True,True,N/A
METRIC,DOUBLE,Percentage of impressions where the viewer watched all of your video.,True,metrics.video_quartile_p100_rate,False,True,True,N/A
METRIC,DOUBLE,Percentage of impressions where the viewer watched 25% of your video.,True,metrics.video_quartile_p25_rate,False,True,True,N/A
METRIC,DOUBLE,Percentage of impressions where the viewer watched 50% of your video.,True,metrics.video_quartile_p50_rate,False,True,True,N/A
METRIC,DOUBLE,Percentage of impressions where the viewer watched 75% of your video.,True,metrics.video_quartile_p75_rate,False,True,True,N/A
METRIC,DOUBLE,"The number of views your TrueView video ad receives divided by its number of impressions, including thumbnail impressions for TrueView in-display ads.",True,metrics.video_view_rate,False,True,True,N/A
METRIC,INT64,The number of times your video ads were viewed.,True,metrics.video_views,False,True,True,N/A
METRIC,INT64,"The total number of view-through conversions. These happen when a customer sees an image or rich media ad, then later completes a conversion on your site without interacting with (for example, clicking on) another ad.",True,metrics.view_through_conversions,False,True,True,N/A
METRIC,DOUBLE,Number of call button clicks on any location surface after an impression. This measure is coming from Asset based location.,True,metrics.view_through_conversions_from_location_asset_click_to_call,False,True,True,N/A
METRIC,DOUBLE,Number of driving directions clicks on any location surface after an impression. This measure is coming from Asset based location.,True,metrics.view_through_conversions_from_location_asset_directions,False,True,True,N/A
METRIC,DOUBLE,Number of menu link clicks on any location surface after an impression. This measure is coming from Asset based location.,True,metrics.view_through_conversions_from_location_asset_menu,False,True,True,N/A
METRIC,DOUBLE,Number of order clicks on any location surface after an impression. This measure is coming from Asset based location.,True,metrics.view_through_conversions_from_location_asset_order,False,True,True,N/A
METRIC,DOUBLE,Number of other types of local action clicks on any location surface after an impression. This measure is coming from Asset based location.,True,metrics.view_through_conversions_from_location_asset_other_engagement,False,True,True,N/A
METRIC,DOUBLE,Estimated number of visits to the store after an impression. This measure is coming from Asset based location.,True,metrics.view_through_conversions_from_location_asset_store_visits,False,True,True,N/A
METRIC,DOUBLE,Number of website URL clicks on any location surface after an impression. This measure is coming from Asset based location.,True,metrics.view_through_conversions_from_location_asset_website,False,True,True,N/A
